root@comp3134:~# tcpdump -n -i eth0
tcpdump: verbose output suppressed, use -v[v]... for full protocol decode
listening on eth0, link-type EN10MB (Ethernet), snapshot length 262144 bytes
04:39:55.195212 IP 137.184.170.50.22 > 142.113.162.178.65434: Flags [P.], seq 743344954:743345062, ack 3442927900, win 479, length 108
04:39:55.195280 IP 137.184.170.50.22 > 142.113.162.178.65434: Flags [P.], seq 108:144, ack 1, win 479, length 36
04:39:55.195312 IP 137.184.170.50.22 > 142.113.162.178.65434: Flags [P.], seq 144:196, ack 1, win 479, length 52
04:39:55.195341 IP 137.184.170.50.22 > 142.113.162.178.65434: Flags [P.], seq 196:264, ack 1, win 479, length 68
04:39:55.195372 IP 137.184.170.50.22 > 142.113.162.178.65434: Flags [P.], seq 264:332, ack 1, win 479, length 68
04:39:55.195400 IP 137.184.170.50.22 > 142.113.162.178.65434: Flags [P.], seq 332:368, ack 1, win 479, length 36
04:39:55.200508 IP 142.113.162.178.65434 > 137.184.170.50.22: Flags [.], ack 368, win 252, length 0
04:39:55.295194 IP 137.184.170.50.22 > 142.113.162.178.65434: Flags [P.], seq 368:884, ack 1, win 479, length 516
04:39:55.295344 IP 137.184.170.50.22 > 142.113.162.178.65434: Flags [P.], seq 884:1248, ack 1, win 479, length 364
04:39:55.299826 IP 142.113.162.178.65434 > 137.184.170.50.22: Flags [.], ack 1248, win 255, length 0
04:39:55.398990 IP 137.184.170.50.22 > 142.113.162.178.65434: Flags [P.], seq 1248:1404, ack 1, win 479, length 156
04:39:55.399104 IP 137.184.170.50.22 > 142.113.162.178.65434: Flags [P.], seq 1404:1656, ack 1, win 479, length 252
04:39:55.404506 IP 142.113.162.178.65434 > 137.184.170.50.22: Flags [.], ack 1656, win 254, length 0
04:39:55.502976 IP 137.184.170.50.22 > 142.113.162.178.65434: Flags [P.], seq 1656:2028, ack 1, win 479, length 372
04:39:55.549898 IP 142.113.162.178.65434 > 137.184.170.50.22: Flags [.], ack 2028, win 252, length 0
04:39:55.607042 IP 137.184.170.50.22 > 142.113.162.178.65434: Flags [P.], seq 2028:2184, ack 1, win 479, length 156
04:39:55.607186 IP 137.184.170.50.22 > 142.113.162.178.65434: Flags [P.], seq 2184:2324, ack 1, win 479, length 140
04:39:55.611968 IP 142.113.162.178.65434 > 137.184.170.50.22: Flags [.], ack 2324, win 251, length 0
04:39:55.711006 IP 137.184.170.50.22 > 142.113.162.178.65434: Flags [P.], seq 2324:2696, ack 1, win 479, length 372
04:39:55.770557 IP 142.113.162.178.65434 > 137.184.170.50.22: Flags [.], ack 2696, win 250, length 0
04:39:55.815003 IP 137.184.170.50.22 > 142.113.162.178.65434: Flags [P.], seq 2696:2852, ack 1, win 479, length 156
04:39:55.815123 IP 137.184.170.50.22 > 142.113.162.178.65434: Flags [P.], seq 2852:2992, ack 1, win 479, length 140
04:39:55.820228 IP 142.113.162.178.65434 > 137.184.170.50.22: Flags [.], ack 2992, win 255, length 0
^C
23 packets captured
26 packets received by filter
0 packets dropped by kernel
